Id,Product,Review
1,Ensemble de draps Queen Size "J'ai récemment acheté l'ensemble de draps Queen Size. La qualité est incroyable, les draps sont doux et très confortables pour dormir. L'ajustement est parfait pour mon matelas queen size. Je suis très content de mon achat."
2, pochette étanche pour téléphone, "Je viens de recevoir ma pochette étanche pour téléphone et ça change la donne. La conception permet un accès facile à mon téléphone tout en le gardant au sec. Idéal pour les sorties à la plage ou simplement pour se détendre au bord de la piscine."
3, Matelas pneumatique de luxe, "Le matelas pneumatique de luxe est assez impressionnant. Il était facile à gonfler et il est super confortable. Le seul problème que j'ai eu était un petit trou, qui était facile à réparer. Dans l'ensemble, un excellent rapport qualité-prix."
4, Insert d'oreillers, "L'insert d'oreillers était un excellent achat. Ils sont moelleux et conservent très bien leur forme. Ils s'intègrent parfaitement dans mes housses de coussin et constituent un excellent ajout à la décoration de mon salon."
5, Mousseur à lait portatif, « L'appareil portatif pour mousseur à lait est très utile. Il rend ma routine de café du matin tellement plus facile. Bien qu'il m'ait fallu un peu de temps pour apprendre à l'utiliser correctement. Mais maintenant, je l'adore. "
6, Gobelet en acier inoxydable, "Le gobelet en acier inoxydable est idéal pour les boissons froides. Il garde mes boissons froides pendant longtemps. De plus, il est facile à nettoyer et à transporter. Je le recommande vivement."
7, Écouteurs Bluetooth, "Les écouteurs Bluetooth sont excellents. Ils se couplent facilement, ont une excellente qualité sonore et la batterie dure assez longtemps. Ajustement confortable aussi !"
8, chargeur portable, "Ce chargeur portable m'a sauvé la vie lors de longs trajets. Il charge mon téléphone rapidement et est suffisamment compact pour être transporté dans ma poche."
9,WiFi Range Extender,"Le WiFi Range Extender a considérablement amélioré le signal WiFi dans ma maison. L'installation a été facile et je n'ai eu aucun problème depuis l'installation."
10, Bouteille d'eau isolée sous vide, "La bouteille d'eau isolée sous vide est superbe. Elle garde ma boisson froide pendant des heures. Le design est élégant et se glisse bien dans mon sac."
11,Fitness Tracker, "Le Fitness Tracker est très intuitif à utiliser. Il suit avec précision mes pas et ma fréquence cardiaque. L'application qui l'accompagne est conviviale et présente clairement les données."
12,Lampe de bureau réglable, "La lampe de bureau réglable est tout simplement parfaite pour mon bureau. Elle fournit un bon éclairage et la fonction réglable est très utile. Elle a un design moderne qui ajoute à l'esthétique de ma pièce."
13, brosse à dents électrique, "La brosse à dents électrique fonctionne très bien. Elle nettoie en profondeur et a une longue durée de vie de la batterie. C'est définitivement une mise à niveau de ma brosse à dents manuelle."
14,Écouteurs antibruit,"Ces écouteurs antibruit valent chaque centime. Ils bloquent la plupart des bruits extérieurs et la qualité sonore est exceptionnelle. Ils sont également confortables à porter pendant de longues périodes."
15,Bloc d'alimentation compact, "Ce bloc d'alimentation compact est très pratique pour les voyages. Il a suffisamment de prises pour tous mes appareils et ne prend pas beaucoup de place dans mon sac."
16, Balance de cuisine, "La balance de cuisine est très précise. Elle est compacte, facile à nettoyer et l'affichage est clair. C'est un excellent outil pour tous ceux qui aiment cuisiner ou faire des pâtisseries."
17,Tapis de souris ergonomique, "Le tapis de souris ergonomique offre un bon soutien pour mon poignet et m'aide à travailler confortablement pendant de longues périodes. La qualité est excellente."
18,Cadre photo numérique, "Le cadre photo numérique affiche les photos de manière claire et lumineuse. Il est facile de télécharger des photos et la fonction de diaporama est géniale."
19, haut-parleur Bluetooth portable, "Le haut-parleur Bluetooth portable a une excellente qualité sonore. Il est facile à connecter à mon téléphone et a une bonne autonomie de batterie."
20,Support pour plantes d'intérieur, "Le support pour plantes d'intérieur est robuste et élégant. C'est une belle façon d'afficher mes plantes d'intérieur et cela ajoute une touche agréable à la décoration de mon salon."